,序号,区县,名   称,方向,相交道路,Unnamed: 5
356,357,海淀,农大北口 ,全方向,永丰路、圆明园西路,马连洼北路
357,358,海淀,百旺家苑北门,全方向,马连洼北路,
358,359,海淀,马连洼街道往东路南第一路口,全方向,竹园西街,马连洼北路
359,360,海淀,马连洼北路百草园东南角路口,全方向,东北旺路,马连洼北路
360,361,海淀,马连洼北路东北旺西路南口,全方向,东北旺西路,马连洼北路
361,362,海淀,马北路与厢黄旗东路西南角,全方向,厢黄旗东路,马连洼北路
362,363,海淀,圆明园西路兰园小区西门口,全方向,圆明园西路,
363,364,海淀,圆明园西路兰园天桥,全方向,圆明园西路,
364,365,海淀,圆明园西路百旺商城西北角,全方向,圆明园西路,
365,366,海淀,中发百旺路口,全方向,圆明园西路,竹园西街
366,367,海淀,圆明园西路北口公交车站西侧,全方向,圆明园西路,
367,368,海淀,圆明园西路中发百旺北100米处,全方向,圆明园西路,
368,369,海淀,圆明园西路中发百旺路口西北角,全方向,圆明园西路,
369,370,海淀,圆明园西路中发百旺路口南侧天桥,全方向,圆明园西路,
370,371,海淀,圆明园西路梅园车站,全方向,圆明园西路,
371,372,海淀,圆明园西路农大南路地铁站B出口,全方向,圆明园西路,
372,373,海淀,圆明园西路63919部队东,全方向,圆明园西路,
373,374,海淀,圆明园西路农大路口南侧天桥,全方向,圆明园西路,
374,375,海淀,圆明园西路肖家河过街天桥,全方向,圆明园西路,
375,376,海淀,农大路口向南路东二路口,全方向,圆明园西路,
376,377,海淀,农大路口肖家河红绿灯往南路西二路口,全方向,圆明园西路,
377,378,海淀,肖家河桥往北路东第一路口处,全方向,圆明园西路,
378,379,海淀,肖家河桥往北路西第一路口处,全方向,圆明园西路,
379,380,海淀,肖家河桥西北角肖家河村口,全方向,圆明园西路,
380,381,海淀,农大路口往西50米路北,全方向,天秀路,
381,382,海淀,天秀路巫山烤鱼门口,全方向,天秀路,
382,383,海淀,天秀路农大附小南门对面,全方向,中关村一小门前路,天秀路
383,384,海淀,天秀路农大附小门前路口,全方向,中关村一小门前路,天秀路
384,385,海淀,天秀路农大附小路口东侧,全方向,天秀路,
385,386,海淀,天秀路天秀花园公交车站路北,全方向,天秀路,
386,387,海淀,天秀路古月园东南门,全方向,天秀路,
387,388,海淀,天秀路古月园南门西侧,全方向,天秀路,
388,389,海淀,天秀路与龙背村路交叉路口,全方向,龙背村路,天秀路
389,390,海淀,天秀路与龙背村路交叉口西,全方向,天秀路,
390,391,海淀,天秀路西口,全方向,马连洼西路,天秀路
391,392,海淀,马连洼西路与天秀路交叉路口,全方向,马连洼西路,天秀路
392,393,海淀,地铁安河桥北站停车场北侧入口,全方向,龙背村路,
393,394,海淀,龙背村路安河桥地铁站B口路口,全方向,龙背村路,
394,395,海淀,龙背村路华联生活超市,全方向,龙背村路,
395,396,海淀,龙背村路华联生活超市北口,全方向,龙背村路,
396,397,海淀,安河桥地铁站C口,全方向,龙背村路,
397,398,海淀,农科院南门,全方向,农大南路,
398,399,海淀,农大南路广泰小区南门对面,全方向,农大南路,
399,400,海淀,农大南路万树园社区超市前,全方向,农大南路,
400,401,海淀,农大南路万树园南门,全方向,农大南路,
401,402,海淀,农大南路厢黄旗公交站路南,全方向,农大南路,
402,403,海淀,农大南路厢黄旗车站路北,全方向,农大南路,
403,404,海淀,农大南路七彩华园北门,全方向,农大南路,
404,405,海淀,博雅西园正门,全方向,农大南路,
405,406,海淀,农大南路北侧博雅西园门前,全方向,农大南路,
406,407,海淀,农大南路与厢黄旗东路西北角,全方向,厢黄旗东路,农大南路
407,408,海淀,农大南路上地医院北口,全方向,树村西路,农大南路
408,409,海淀,树村路与农大南路路口,全方向,树村路,农大南路
409,410,丰台,群星路与芳星路交叉口 东向西,东向西,群星路,芳星路
410,411,丰台,京港澳高速辅路郭庄子加油站东,出京,京港澳高速辅路,
411,412,丰台,小屯西路南口,南向北,小屯西路,
412,413,丰台,小屯西路南口,北向南,小屯西路,
413,414,石景山,八角东街与时代花园北路交叉口 北向南,北向南,八角东街,时代花园北路
414,415,房山,京深路与怡和路交叉口 北向南,北向南,京深路,怡和路
415,416,大兴,旧忠东街与忠凉路交叉口西北角,全方向,旧忠东街,忠凉路
416,417,大兴,庑殿路与科技路交叉口东南角,全方向,庑殿路,科技路
417,418,大兴,庑殿路622路公交车科技路车站（路西侧）,全方向,庑殿路,科技路
418,419,大兴,庑殿路与宣颐路交叉口东南角,全方向,庑殿路,宣颐路
419,420,大兴,庑殿路与北牛场路（吉百利）路西侧,全方向,庑殿路,北牛场路
420,421,大兴,庑殿路旺兴湖公园大门北侧路西,全方向,庑殿路,吉百利路
421,422,大兴,南场东街庑殿家苑小区东侧路北,全方向,庑殿西路,南场东街
422,423,大兴,南场东街与庑殿西路交叉口东北角,全方向,庑殿西路,南场东街
423,424,大兴,庑殿路与南场东街交叉口西南角,全方向,庑殿路,南场东街
424,425,大兴,德贤路西辅路世界之花前,全方向,德贤路,久敬庄路
425,426,大兴,德贤路与万源南路交叉口西北角,全方向,德贤路,万源南路
426,427,大兴,德贤路与万源南路交叉口东南角,全方向,德贤路,万源南路
427,428,大兴,北牛场路润星家园门前,全方向,庑殿路,北牛场路
428,429,大兴,旧宫东西大街与小红门路交叉口西南角,全方向,小红门路,旧宫东西大街
429,430,大兴,安采路K4公里处,东向西,安采路,
430,431,大兴,安采路K4公里处,西向东,安采路,
431,432,大兴,中水渠路后查路,南向北,中水渠路,后查路
432,433,大兴,中水渠路后查路,西向东,中水渠路,后查路
433,434,大兴,中水渠路后查路,北向南,中水渠路,后查路
434,435,大兴,中水渠路后查路,东向西,中水渠路,后查路
435,436,大兴,兴丰大街与康庄路口向北300米,南向北,兴丰大街,铁五院西门
436,437,大兴,兴丰大街与康庄路口向北300米,北向南,兴丰大街,铁五院西门
437,438,通州,新华南路与玉带河东街交叉口 南向北,南向北,新华南路,玉带河东街
438,439,昌平,府学路与双拥路交叉口 东向西,东向西,府学路,双拥路
439,440,昌平,昌流路神牛环岛西260米,全方向,昌流路,
440,441,昌平,昌流路神牛环岛西540米,全方向,昌流路,
441,442,昌平,南辛路十五中东门南,全方向,南辛路,
442,443,昌平,南辛路十五中东门北,全方向,南辛路,
443,444,昌平,育知路华北电力大学附属小学路口北,全方向,育知路,
444,445,昌平,育知路华北电力大学附属小学路口南,全方向,育知路,
445,446,昌平,太平庄北街吉晟别墅路口东北角,全方向,太平庄北街,
446,447,昌平,黄平路北新家园小区口西侧,全方向,黄平路,
447,448,昌平,黄平路石油管理干部学院口北侧,全方向,黄平路,
448,449,密云,G101国道K61路段1号杆,南向北,G101国道K61路段,
449,450,密云,G101国道K62路段1号杆,北向南,G101国道K62路段,
450,451,密云,G101国道K62路段2号杆,北向南,G101国道K62路段,
451,452,密云,G101国道K63路段1号杆,南向北,G101国道K63路段,
452,453,密云,G101国道K66路段1号杆,南向北,G101国道K66路段,
453,454,密云,G101国道K70路段2号杆,东向西,G101国道K70路段,
454,455,密云,G101国道上河湾小区K69路段1号杆,西向东,G101国道上河湾小区K69路段,
455,456,密云,G101国道看守所K68路段1号杆,西向东,G101国道看守所K68路段,
456,457,密云,G101国道新里各庄小区K68路段1号杆,西向东,G101国道新里各庄小区K68路段,
457,458,密云,密关路车管所K4路段1号杆,南向北,密关路,
458,459,密云,密关路白河公园K4路段1号杆,南向北,密关路,
459,460,密云,密关路东智东村K4路段1号杆,南向北,密关路,
460,461,密云,密关路龙凤酒业酒厂K7路段1号杆,南向北,密关路,
461,462,密云,顺密路飞鸿世纪园K32路段2号杆,北向南,顺密路,
462,463,密云,密关路全民体育健身公园K0路段2号杆,南向北,密关路,
463,464,密云,密关路全民体育健身公园K0路段4号杆,北向南,密关路,
464,465,密云,密关路K1路段1号杆,南向北,密关路,
465,466,密云,密关路云启公园K2路段1号杆,南向北,密关路,
466,467,密云,密关路刑警队公交站牌K2路段路段1号杆,北向南,密关路,
467,468,密云,密关路鸿泽园小区K2路段1号杆,南向北,密关路,
468,469,密云,密关路云秀花园K3路段1号杆,北向南,密关路,
469,470,密云,密关路云秀花园K3路段2号杆,南向北,密关路,
470,471,密云,密关路沙河铁桥K3路段1号杆,北向南,密关路,
471,472,密云,密关路车管所K4路段2号杆,北向南,密关路,
472,473,密云,密关路西智村路口K7路段1号杆,北向南,密关路,
473,474,密云,密关路东智北村K7路段1号杆,南向北,密关路,
474,475,密云,密关路彼岸香醍K11路段1号杆,南向北,密关路,
475,476,密云,密关路云水公园K11路段1号杆,南向北,密关路,
476,477,密云,密关路溪翁庄村K12路段1号杆,南向北,密关路,
477,478,密云,渔街口门子村K2路段2号杆,东向西,渔街口门子村,
478,479,密云,水库南线溪翁庄镇政府K1路段1号杆,东向西,水库南线溪翁庄镇政府,
479,480,密云,密关路溪翁庄村支部K12路段3号杆,北向南,密关路溪翁庄村支部,
480,481,密云,渔街口门子村K2路段4号杆,西向东,渔街口门子村,
481,482,密云,密关路丰富农贸市场K11路段4号杆,北向南,密关路丰富农贸市场,
482,483,密云,密关路溪翁庄公交站牌K12路段1号杆,北向南,密关路溪翁庄公交站牌,
483,484,密云,G101国道与岭东路交叉口,北向南,G101国道,岭东路
484,485,密云,G101国道与檀西路交叉口1号,东向西,檀西路,G101国道
485,486,密云,G101国道与檀西路交叉口2号,东向西,檀西路,G101国道
486,487,密云,G101国道与檀西路交叉口,南向北,檀西路,G101国道
487,488,密云,G101国道与新南路交叉口,北向南,G101国道,新南路
488,489,密云,G101国道与新南路交叉口,西向东,沙石路,G101国道
489,490,密云,密关路与鼓楼西大街交叉口,北向南,密关路,鼓楼西大街
490,491,密云,G101国道密10路公交总站路口,东向西,G101国道,
491,492,密云,G101国道密10路公交总站路口,西向东,G101国道,
492,493,密云,滨河路与白云街交叉口,东向西,滨河路,白云街
493,494,密云,G101国道与行宫街交叉口,西向东,行宫街,G101国道
494,495,密云,G101国道与檀东路交叉口,东向西,檀东路,G101国道
495,496,密云,G101国道与檀东路交叉口,西向东,檀东路,G101国道
496,497,密云,G101国道与檀营街交叉口,西向东,檀营街,G101国道
497,498,密云,滨河路与白云街交叉口,北向南,滨河路,白云街
